<?xml version="1.0" encoding="utf-8"?>
<xs:schema attributeFormDefault="unqualified" elementFormDefault="qualified" xmlns:xs="http://www.w3.org/2001/XMLSchema">
 <xs:element name="bachillerato">
    <xs:complexType>
      <xs:sequence>
        <xs:element maxOccurs="unbounded" name="asignatura">
          <xs:complexType>
            <xs:sequence>
                <xs:element name="nombre" type="xs:string"/>
                <xs:element name="contenidos">
                    <xs:complexType>
                        <xs:sequence>
                            <xs:element name="tema" maxOccurs="unbounded">
                                <xs:complexType>
                                    <xs:sequence>
                                        <xs:element name="nombre" type="xs:string"/>
                                        <xs:element name="descripcion" type="xs:string"/>
                                    </xs:sequence>
                                </xs:complexType>
                            </xs:element>
                        </xs:sequence>
                    </xs:complexType>
                </xs:element>
            </xs:sequence>
          </xs:complexType>
        </xs:element>
      </xs:sequence>
    </xs:complexType>
 </xs:element>
</xs:schema>